{
  "artifacts": [
    {
      "digest": "9d68a732111561885791ec4dbd6b17cf3a31d6ba67fd9b59ed2c95efdd9a0544",
      "path": "Build/Feature027Validation/presentation-smoke/presentation-probe.json"
    },
    {
      "digest": "ecb03270d35424b6a0faaa52670bae5e5a4678b20466eec2a0a380ca92a9deda",
      "path": "Build/Feature027Validation/presentation-smoke/presentation-smoke.log"
    }
  ],
  "backend": "metal",
  "counts": {
    "frames": 120,
    "iterations": 1,
    "lifecycleCycles": 4
  },
  "device": {
    "capabilityDigest": "7ebdde1f9560449a72351ff14ac9f7c6fc690eed6818102daa5d499f72370afe",
    "identity": "registry-4294968412",
    "name": "Apple M4 Pro"
  },
  "host": {
    "architecture": "arm64",
    "os": "macos"
  },
  "ownership": {
    "device": 0,
    "inFlight": 0,
    "objects": 0,
    "presentation": 0
  },
  "probes": [
    {
      "evidenceDigest": "9d68a732111561885791ec4dbd6b17cf3a31d6ba67fd9b59ed2c95efdd9a0544",
      "name": "metal-presentation-layer-lifecycle",
      "result": "passed"
    }
  ],
  "reportDigest": "8eb53dfad5edef86f881b678bf23ad5eeebeb347641a206002851367cd3ddbac",
  "result": "passed",
  "revision": "80a55f7f891073b87d8c581813834626125193c8",
  "schemaVersion": 1,
  "tier": "visible-manual",
  "workload": "metal-presentation-smoke"
}
