{
  "artifacts": [],
  "backend": "shared",
  "counts": {
    "frames": 0,
    "iterations": 10000,
    "lifecycleCycles": 10000
  },
  "host": {
    "architecture": "arm64",
    "os": "macos"
  },
  "memory": {
    "absoluteGrowthBytes": 0,
    "allowedGrowthBytes": 16777216,
    "finalMedianBytes": 12877824,
    "firstMedianBytes": 12877824,
    "passed": true,
    "relativeGrowth": 0.0,
    "sampleInterval": 100,
    "samplesBytes": [
      12861440,
      12877824,
      12877824,
      12877824,
      12877824,
      12877824,
      12877824,
      12877824,
      12877824,
      12877824,
      12877824,
      12877824,
      12877824,
      12877824,
      12877824,
      12877824,
      12877824,
      12877824,
      12877824,
      12877824,
      12877824,
      12877824,
      12877824,
      12877824,
      12877824,
      12877824,
      12877824,
      12877824,
      12877824,
      12877824,
      12877824,
      12877824,
      12877824,
      12877824,
      12877824,
      12877824,
      12877824,
      12877824,
      12877824,
      12877824,
      12877824,
      12877824,
      12877824,
      12877824,
      12877824,
      12877824,
      12877824,
      12877824,
      12877824,
      12877824,
      12877824,
      12877824,
      12877824,
      12877824,
      12877824,
      12877824,
      12877824,
      12877824,
      12877824,
      12877824,
      12877824,
      12877824,
      12877824,
      12877824,
      12877824,
      12877824,
      12877824,
      12877824,
      12877824,
      12877824,
      12877824,
      12877824,
      12877824,
      12877824,
      12877824,
      12877824,
      12877824,
      12877824,
      12877824,
      12877824,
      12877824,
      12877824,
      12877824,
      12877824,
      12877824,
      12877824,
      12877824,
      12877824,
      12877824,
      12877824
    ],
    "warmupIterations": 1000
  },
  "ownership": {
    "commands": 0,
    "device": 0,
    "inFlight": 0,
    "pipelines": 0,
    "resources": 0,
    "submissions": 0
  },
  "probes": [
    {
      "name": "shared-ownership-lifecycle",
      "result": "unsupported"
    }
  ],
  "reportDigest": "80ad95c15d555005f099f4bcef66279a3b37d7dc1edb09c09f5605537a847a80",
  "result": "unavailable",
  "revision": "5244d5086860f4da5548e3b581945adf417146b5",
  "schemaVersion": 1,
  "tier": "deterministic",
  "workload": "metal-lifecycle-stress"
}
